{
  "version": "0.1",
  "file": "src/lib_json/json_writer.cpp",
  "source_hash": "ffb0cac91aea2ce089d676626fafacad396cef9df2518b47938b0e49e105de9b",
  "source_length": 36026,
  "nodes": [
    {
      "kind": "other",
      "name": null,
      "span": {
        "start_byte": 0,
        "end_byte": 244,
        "start_line": 1,
        "end_line": 5
      },
      "header_span": null,
      "body_span": null,
      "header": null,
      "text": "// Copyright 2011 Baptiste Lepilleur and The JsonCpp Authors\n// Distributed under MIT license, or public domain if desired and\n// recognized in your jurisdiction.\n// See file LICENSE for detail or copy at http://jsoncpp.sourceforge.net/LICENSE\n",
      "children": []
    },
    {
      "kind": "macro",
      "name": null,
      "span": {
        "start_byte": 244,
        "end_byte": 279,
        "start_line": 5,
        "end_line": 6
      },
      "header_span": null,
      "body_span": null,
      "header": null,
      "text": "\n#if !defined(JSON_IS_AMALGAMATION)",
      "children": []
    },
    {
      "kind": "other",
      "name": null,
      "span": {
        "start_byte": 279,
        "end_byte": 280,
        "start_line": 6,
        "end_line": 7
      },
      "header_span": null,
      "body_span": null,
      "header": null,
      "text": "\n",
      "children": []
    },
    {
      "kind": "include",
      "name": "#include \"json_tool.h\"",
      "span": {
        "start_byte": 280,
        "end_byte": 302,
        "start_line": 7,
        "end_line": 7
      },
      "header_span": null,
      "body_span": null,
      "header": null,
      "text": "#include \"json_tool.h\"",
      "children": []
    },
    {
      "kind": "other",
      "name": null,
      "span": {
        "start_byte": 302,
        "end_byte": 303,
        "start_line": 7,
        "end_line": 8
      },
      "header_span": null,
      "body_span": null,
      "header": null,
      "text": "\n",
      "children": []
    },
    {
      "kind": "include",
      "name": "#include <json/writer.h>",
      "span": {
        "start_byte": 303,
        "end_byte": 327,
        "start_line": 8,
        "end_line": 8
      },
      "header_span": null,
      "body_span": null,
      "header": null,
      "text": "#include <json/writer.h>",
      "children": []
    },
    {
      "kind": "other",
      "name": null,
      "span": {
        "start_byte": 327,
        "end_byte": 328,
        "start_line": 8,
        "end_line": 9
      },
      "header_span": null,
      "body_span": null,
      "header": null,
      "text": "\n",
      "children": []
    },
    {
      "kind": "macro",
      "name": null,
      "span": {
        "start_byte": 328,
        "end_byte": 371,
        "start_line": 9,
        "end_line": 9
      },
      "header_span": null,
      "body_span": null,
      "header": null,
      "text": "#endif // if !defined(JSON_IS_AMALGAMATION)",
      "children": []
    },
    {
      "kind": "other",
      "name": null,
      "span": {
        "start_byte": 371,
        "end_byte": 372,
        "start_line": 9,
        "end_line": 10
      },
      "header_span": null,
      "body_span": null,
      "header": null,
      "text": "\n",
      "children": []
    },
    {
      "kind": "include",
      "name": "#include <algorithm>",
      "span": {
        "start_byte": 372,
        "end_byte": 392,
        "start_line": 10,
        "end_line": 10
      },
      "header_span": null,
      "body_span": null,
      "header": null,
      "text": "#include <algorithm>",
      "children": []
    },
    {
      "kind": "other",
      "name": null,
      "span": {
        "start_byte": 392,
        "end_byte": 393,
        "start_line": 10,
        "end_line": 11
      },
      "header_span": null,
      "body_span": null,
      "header": null,
      "text": "\n",
      "children": []
    },
    {
      "kind": "include",
      "name": "#include <cassert>",
      "span": {
        "start_byte": 393,
        "end_byte": 411,
        "start_line": 11,
        "end_line": 11
      },
      "header_span": null,
      "body_span": null,
      "header": null,
      "text": "#include <cassert>",
      "children": []
    },
    {
      "kind": "other",
      "name": null,
      "span": {
        "start_byte": 411,
        "end_byte": 412,
        "start_line": 11,
        "end_line": 12
      },
      "header_span": null,
      "body_span": null,
      "header": null,
      "text": "\n",
      "children": []
    },
    {
      "kind": "include",
      "name": "#include <cctype>",
      "span": {
        "start_byte": 412,
        "end_byte": 429,
        "start_line": 12,
        "end_line": 12
      },
      "header_span": null,
      "body_span": null,
      "header": null,
      "text": "#include <cctype>",
      "children": []
    },
    {
      "kind": "other",
      "name": null,
      "span": {
        "start_byte": 429,
        "end_byte": 430,
        "start_line": 12,
        "end_line": 13
      },
      "header_span": null,
      "body_span": null,
      "header": null,
      "text": "\n",
      "children": []
    },
    {
      "kind": "include",
      "name": "#include <cmath>",
      "span": {
        "start_byte": 430,
        "end_byte": 446,
        "start_line": 13,
        "end_line": 13
      },
      "header_span": null,
      "body_span": null,
      "header": null,
      "text": "#include <cmath>",
      "children": []
    },
    {
      "kind": "other",
      "name": null,
      "span": {
        "start_byte": 446,
        "end_byte": 447,
        "start_line": 13,
        "end_line": 14
      },
      "header_span": null,
      "body_span": null,
      "header": null,
      "text": "\n",
      "children": []
    },
    {
      "kind": "include",
      "name": "#include <cstdio>",
      "span": {
        "start_byte": 447,
        "end_byte": 464,
        "start_line": 14,
        "end_line": 14
      },
      "header_span": null,
      "body_span": null,
      "header": null,
      "text": "#include <cstdio>",
      "children": []
    },
    {
      "kind": "other",
      "name": null,
      "span": {
        "start_byte": 464,
        "end_byte": 465,
        "start_line": 14,
        "end_line": 15
      },
      "header_span": null,
      "body_span": null,
      "header": null,
      "text": "\n",
      "children": []
    },
    {
      "kind": "include",
      "name": "#include <cstring>",
      "span": {
        "start_byte": 465,
        "end_byte": 483,
        "start_line": 15,
        "end_line": 15
      },
      "header_span": null,
      "body_span": null,
      "header": null,
      "text": "#include <cstring>",
      "children": []
    },
    {
      "kind": "other",
      "name": null,
      "span": {
        "start_byte": 483,
        "end_byte": 484,
        "start_line": 15,
        "end_line": 16
      },
      "header_span": null,
      "body_span": null,
      "header": null,
      "text": "\n",
      "children": []
    },
    {
      "kind": "include",
      "name": "#include <iomanip>",
      "span": {
        "start_byte": 484,
        "end_byte": 502,
        "start_line": 16,
        "end_line": 16
      },
      "header_span": null,
      "body_span": null,
      "header": null,
      "text": "#include <iomanip>",
      "children": []
    },
    {
      "kind": "other",
      "name": null,
      "span": {
        "start_byte": 502,
        "end_byte": 503,
        "start_line": 16,
        "end_line": 17
      },
      "header_span": null,
      "body_span": null,
      "header": null,
      "text": "\n",
      "children": []
    },
    {
      "kind": "include",
      "name": "#include <memory>",
      "span": {
        "start_byte": 503,
        "end_byte": 520,
        "start_line": 17,
        "end_line": 17
      },
      "header_span": null,
      "body_span": null,
      "header": null,
      "text": "#include <memory>",
      "children": []
    },
    {
      "kind": "other",
      "name": null,
      "span": {
        "start_byte": 520,
        "end_byte": 521,
        "start_line": 17,
        "end_line": 18
      },
      "header_span": null,
      "body_span": null,
      "header": null,
      "text": "\n",
      "children": []
    },
    {
      "kind": "include",
      "name": "#include <set>",
      "span": {
        "start_byte": 521,
        "end_byte": 535,
        "start_line": 18,
        "end_line": 18
      },
      "header_span": null,
      "body_span": null,
      "header": null,
      "text": "#include <set>",
      "children": []
    },
    {
      "kind": "other",
      "name": null,
      "span": {
        "start_byte": 535,
        "end_byte": 536,
        "start_line": 18,
        "end_line": 19
      },
      "header_span": null,
      "body_span": null,
      "header": null,
      "text": "\n",
      "children": []
    },
    {
      "kind": "include",
      "name": "#include <sstream>",
      "span": {
        "start_byte": 536,
        "end_byte": 554,
        "start_line": 19,
        "end_line": 19
      },
      "header_span": null,
      "body_span": null,
      "header": null,
      "text": "#include <sstream>",
      "children": []
    },
    {
      "kind": "other",
      "name": null,
      "span": {
        "start_byte": 554,
        "end_byte": 555,
        "start_line": 19,
        "end_line": 20
      },
      "header_span": null,
      "body_span": null,
      "header": null,
      "text": "\n",
      "children": []
    },
    {
      "kind": "include",
      "name": "#include <utility>",
      "span": {
        "start_byte": 555,
        "end_byte": 573,
        "start_line": 20,
        "end_line": 20
      },
      "header_span": null,
      "body_span": null,
      "header": null,
      "text": "#include <utility>",
      "children": []
    },
    {
      "kind": "other",
      "name": null,
      "span": {
        "start_byte": 573,
        "end_byte": 574,
        "start_line": 20,